{
  "country": "Mexico",
  "iso3": "MEX",
  "methodology_version": "2.0-pre-source-audit",
  "assessed_on": "2026-05-28",
  "subject_profile": {
    "summary": "Highly educated American, board-certified laboratory animal veterinarian (ACLAM), considering relocation.",
    "profession": "Board-certified laboratory animal veterinarian (ACLAM)",
    "citizenship": "United States",
    "stated_values": [
      "Rule of law and institutional integrity weighted most heavily",
      "Personal freedom and security from arbitrary state action are foundational",
      "Economic success is contingent on rule of law, not a substitute for it"
    ]
  },
  "flags": [
    "Scores predate full v2 source-discipline re-run.",
    "Framework may undervalue Mexico's asymmetric upside (nearshoring, demographic dividend); flagged for re-scoring under skew discipline."
  ],
  "category_weights_by_decision": {
    "living": { "economic": 0.15, "institutional": 0.30, "political_social": 0.25, "geopolitical": 0.05, "physical_practical": 0.10, "personal_fit": 0.15 },
    "assets": { "economic": 0.40, "institutional": 0.25, "political_social": 0.10, "geopolitical": 0.15, "physical_practical": 0.10, "personal_fit": 0.0 },
    "currency": { "economic": 0.60, "institutional": 0.20, "political_social": 0.05, "geopolitical": 0.15, "physical_practical": 0.0, "personal_fit": 0.0 }
  },
  "categories": {
    "economic": {
      "score": 0.5,
      "confidence": 0.71,
      "skew": "positive",
      "notes": "Moderate debt, autonomous central bank, nearshoring tailwind offset by Pemex liability and US tariff exposure.",
      "sub_factors": {
        "fiscal_state": { "score": -1, "weight": 0.25, "confidence": 0.65, "notes": "Deficit ~3.5% target under Sheinbaum; debt-to-GDP ~50% (moderate); Pemex a major liability." },
        "monetary_independence": { "score": 3, "weight": 0.25, "confidence": 0.75, "notes": "Banxico strong autonomy; inflation framework respected; no government pressure." },
        "reserve_currency_intl_monetary": { "score": 0, "weight": 0.20, "confidence": 0.80, "notes": "Peso not a reserve currency; neutral." },
        "inflation": { "score": 0, "weight": 0.15, "confidence": 0.65, "notes": "Near target band; peso weakness adds imported inflation." },
        "banking_stability": { "score": 2, "weight": 0.10, "confidence": 0.70, "notes": "Stable, well-capitalized, foreign-bank dominated plus Banorte; competent CNBV." },
        "trade_policy": { "score": -5, "weight": 0.05, "confidence": 0.75, "notes": "Heavy US tariff exposure under USMCA; nearshoring benefits undercut by tariff volatility." }
      }
    },
    "institutional": {
      "score": -4.9,
      "confidence": 0.71,
      "skew": "negative",
      "notes": "Major deterioration under judicial reforms (elected judges); mirror image of Canada. Long-term composite ~-5 as effects compound.",
      "sub_factors": {
        "rule_of_law": { "score_near": -6, "score_long": -7, "score": null, "weight": 0.35, "confidence": 0.75, "notes": "2024 judicial reforms weakened independence (popularly elected judges); Supreme Court restructured; Morena supermajority passes constitutional changes unopposed; WJP dropped." },
        "statistical_integrity": { "score": -2, "weight": 0.25, "confidence": 0.60, "notes": "INEGI generally respected but pressures rising; some methodology questioned." },
        "civil_service_capacity": { "score": -5, "weight": 0.25, "confidence": 0.70, "notes": "Hollowed during AMLO austerity; Pemex/CFE politicized; regulators (CRE, COFECE) weakened." },
        "press_freedom": { "score": -6, "weight": 0.15, "confidence": 0.80, "notes": "Among the world's most dangerous countries for journalists; continued attacks on critical media." }
      }
    },
    "political_social": {
      "score": -1.2,
      "confidence": 0.72,
      "skew": "negative",
      "notes": "Cartel violence is the acute issue; welcoming to expatriates is a genuine offset. Long-term ~-2 (political stability softens).",
      "sub_factors": {
        "political_stability": { "score": -1, "weight": 0.30, "confidence": 0.65, "notes": "Sheinbaum mandate, Morena supermajorities; stable but weak opposition concerning for institutional health." },
        "civil_liberties": { "score": -3, "weight": 0.20, "confidence": 0.65, "notes": "Protections on paper but weak enforcement; surveillance issues; limited recourse." },
        "treatment_non_citizens": { "score": 3, "weight": 0.25, "confidence": 0.70, "notes": "Welcoming to foreign retirees, professionals, digital nomads; established expat communities; favorable for relocation TO Mexico." },
        "social_violence": { "score_near": -8, "score_long": -8, "score": null, "weight": 0.15, "confidence": 0.85, "notes": "2026 cartel unrest after El Mencho killing; 70+ attacks in Guanajuato; homicide 23.3/100k; cartel control of state functions in parts of multiple states." },
        "demographics": { "score_near": 3, "score_long": 2, "score": null, "weight": 0.10, "confidence": 0.75, "notes": "Median age 29; positive long-term profile; narrowing over time." }
      }
    },
    "geopolitical": {
      "score": 0.1,
      "confidence": 0.68,
      "skew": "symmetric",
      "notes": "Few alliance dependencies to lose; no external wars; internal cartel conflict is counterinsurgency-like.",
      "sub_factors": {
        "alliance_reliability": { "score": -1, "weight": 0.40, "confidence": 0.70, "notes": "USMCA and bilateral US relationship dominate; tariff/immigration/drug tensions; no fundamental alliance to lose; diversifying EU/LatAm." },
        "conflict_involvement": { "score": 0, "weight": 0.35, "confidence": 0.65, "notes": "No external conflict; cartel violence internal; possible unilateral US strikes on cartels discussed, not implemented." },
        "sanctions_capital_controls": { "score": 2, "weight": 0.25, "confidence": 0.75, "notes": "No sanctions; free capital flows; limited control risk; some individual designations re: cartels." }
      }
    },
    "physical_practical": {
      "score": -1.7,
      "confidence": 0.71,
      "skew": "symmetric",
      "notes": "Excellent affordable private healthcare and favorable highland climate offset by high violent crime and uneven infrastructure.",
      "sub_factors": {
        "climate": { "score": 0, "weight": 0.20, "confidence": 0.60, "notes": "Variable; northern water stress, coastal hurricanes; central highlands favorable." },
        "healthcare": { "score": 1, "weight": 0.30, "confidence": 0.70, "notes": "Public IMSS/ISSSTE inconsistent; private excellent and affordable; medical-tourism destination." },
        "infrastructure": { "score": -2, "weight": 0.20, "confidence": 0.70, "notes": "Major cities good; rural underdeveloped; grid reliability declined; water stressed." },
        "crime_safety": { "score": -7, "weight": 0.15, "confidence": 0.85, "notes": "Among highest violent crime globally; some safe enclaves (parts of CDMX, San Miguel, Queretaro, Merida)." },
        "disaster_insurance": { "score": -2, "weight": 0.15, "confidence": 0.70, "notes": "Earthquake and coastal hurricane exposure; insurance less developed but functional." }
      }
    },
    "personal_fit": {
      "score": 1,
      "confidence": 0.70,
      "skew": "symmetric",
      "notes": "Limited lab animal medicine infrastructure; thin specialty market for ACLAM-boarded; could work faculty or multinational pharma but deep career market absent. Strong for general/tropical vet work, weak for this specialty.",
      "sub_factors": {
        "labanimal_vet_fit": { "score": 1, "weight": 1.0, "confidence": 0.70, "notes": "Deeply overqualified for available roles; small market; recommend only with specific personal reasons." }
      }
    }
  },
  "decisions": {
    "living": { "score": -1.93, "confidence": 0.72, "horizon": "5-10y", "reading": "mixed-negative" },
    "assets": { "score": -1.30, "confidence": 0.71, "horizon": "3-7y", "reading": "mixed-negative" },
    "currency": { "score": -0.73, "confidence": 0.71, "horizon": "1-3y", "reading": "mixed" }
  },
  "summary": "Despite serious institutional and security problems, Mexico outperforms the US on relocation because US deterioration has converged toward Mexico's baseline. Institutional weakness (-4.9, judicial restructuring) is the mirror image of Canada's strength. Counterintuitively, the peso scores better than USD for currency holding because it lacks the dollar's specific reserve-status downside. Weak fit for the subject's specific profession. Flagged for possible re-scoring: framework may undervalue nearshoring/demographic upside."
}
