{
  "country": "Sweden",
  "iso3": "SWE",
  "methodology_version": "2.0-pre-source-audit",
  "assessed_on": "2026-05-28",
  "subject_profile": {
    "summary": "Highly educated American, board-certified laboratory animal veterinarian (ACLAM), considering relocation.",
    "profession": "Board-certified laboratory animal veterinarian (ACLAM)",
    "citizenship": "United States",
    "stated_values": [
      "Rule of law and institutional integrity weighted most heavily",
      "Personal freedom and security from arbitrary state action are foundational",
      "Economic success is contingent on rule of law, not a substitute for it"
    ]
  },
  "flags": [
    "Scores predate full v2 source-discipline re-run.",
    "Gang-violence country-average overstates personal risk for residents outside affected suburbs.",
    "Russia conflict-exposure is a genuine tail risk not fully captured by expected-value scoring.",
    "Sept 2026 election could shift political/social scores at the margin."
  ],
  "category_weights_by_decision": {
    "living": { "economic": 0.15, "institutional": 0.30, "political_social": 0.25, "geopolitical": 0.05, "physical_practical": 0.10, "personal_fit": 0.15 },
    "assets": { "economic": 0.40, "institutional": 0.25, "political_social": 0.10, "geopolitical": 0.15, "physical_practical": 0.10, "personal_fit": 0.0 },
    "currency": { "economic": 0.60, "institutional": 0.20, "political_social": 0.05, "geopolitical": 0.15, "physical_practical": 0.0, "personal_fit": 0.0 }
  },
  "categories": {
    "economic": {
      "score": 3.7,
      "confidence": 0.78,
      "skew": "symmetric",
      "notes": "Among the strongest economic profiles assessed: very low debt, disciplined fiscal framework, independent Riksbank, low-oil-exposure energy mix.",
      "sub_factors": {
        "fiscal_state": { "score": 6, "weight": 0.25, "confidence": 0.80, "notes": "Deficit ~1.3% GDP; debt ~30% GDP (among lowest in developed world); post-1990s fiscal framework; rising but absorbable defense spend." },
        "monetary_independence": { "score": 5, "weight": 0.25, "confidence": 0.80, "notes": "Riksbank strongly independent; rate held at 1.75%; credible framework." },
        "reserve_currency_intl_monetary": { "score": 0, "weight": 0.20, "confidence": 0.85, "notes": "SEK not a reserve currency; neutral." },
        "inflation": { "score": 4, "weight": 0.15, "confidence": 0.75, "notes": "Below 2% target (~1.5% 2026, helped by food VAT cuts); krona appreciation; nuclear/hydro reduces oil exposure." },
        "banking_stability": { "score": 4, "weight": 0.10, "confidence": 0.75, "notes": "Well-capitalized majors; past Baltic-AML issues addressed; 2022-23 housing correction without systemic crisis." },
        "trade_policy": { "score": -1, "weight": 0.05, "confidence": 0.70, "notes": "EU-delegated; strong export economy; indirect exposure to supply-chain disruption and US tariffs." }
      }
    },
    "institutional": {
      "score": 6.4,
      "confidence": 0.82,
      "skew": "symmetric",
      "notes": "Highest single-category score and highest confidence in the set. Genuinely excellent institutional baseline.",
      "sub_factors": {
        "rule_of_law": { "score": 6, "weight": 0.35, "confidence": 0.80, "notes": "Top-5 globally (WJP); strong judicial independence; recent gang-related police/surveillance expansions via normal democratic process." },
        "statistical_integrity": { "score": 7, "weight": 0.25, "confidence": 0.85, "notes": "SCB highly regarded; no interference; near top of indices." },
        "civil_service_capacity": { "score": 6, "weight": 0.25, "confidence": 0.80, "notes": "Professional, independent; constitutionally protected agency independence (myndighetsoberoende)." },
        "press_freedom": { "score": 7, "weight": 0.15, "confidence": 0.85, "notes": "Top-5 RWB; world's oldest FOI act (1766); robust public and private media." }
      }
    },
    "political_social": {
      "score": 0.4,
      "confidence": 0.71,
      "skew": "symmetric",
      "notes": "Striking: excellent institutions but gang violence and immigration restrictiveness pull social state near neutral. Long-term composite improves (~+1) as violence trend declines.",
      "sub_factors": {
        "political_stability": { "score": 3, "weight": 0.30, "confidence": 0.70, "notes": "Kristersson government stable since 2022; Sept 2026 election upcoming; SD rise within democratic norms." },
        "civil_liberties": { "score": 3, "weight": 0.20, "confidence": 0.70, "notes": "Strong baseline; surveillance trajectory concerning (anonymous witnesses, expanded wiretapping, proposed military aid to police)." },
        "treatment_non_citizens": { "score": -1, "weight": 0.25, "confidence": 0.70, "notes": "Shifted from most-open to among-most-restrictive in ~5y; refugee/family-reunification cut; citizenship tightened; skilled-professional path still functional." },
        "social_violence": { "score_near": -4, "score_long": -2, "score": null, "weight": 0.15, "confidence": 0.75, "notes": "621 explosion offences in 2025 (vs 162 in 2018); 62k in criminal networks; but 2026 shootings down sharply (15 vs 39 early-year); geographically concentrated." },
        "demographics": { "score_near": -2, "score_long": -3, "score": null, "weight": 0.10, "confidence": 0.70, "notes": "Immigration-cut growth slowdown; below-replacement fertility; integration challenges; skilled-labor shortages." }
      }
    },
    "geopolitical": {
      "score": 1.2,
      "confidence": 0.74,
      "skew": "negative",
      "notes": "Strong alliance reliability (credibility provider post-NATO accession) offset by direct Russia conflict-exposure tail risk.",
      "sub_factors": {
        "alliance_reliability": { "score": 5, "weight": 0.40, "confidence": 0.75, "notes": "NATO member since 2024; deep Nordic-Baltic cooperation; building EU credibility as US reliability falls; leads NATO forward forces in Finland." },
        "conflict_involvement": { "score_near": -4, "score_long": -3, "score": null, "weight": 0.35, "confidence": 0.70, "notes": "Direct Russia threat as Baltic-adjacent NATO member; hybrid ops, airspace violations; conscription reintroduced; Article 5 tail risk real but not base case." },
        "sanctions_capital_controls": { "score": 2, "weight": 0.25, "confidence": 0.80, "notes": "EU sanctions regime; no domestic capital controls; stable financial integration." }
      }
    },
    "physical_practical": {
      "score": 3.8,
      "confidence": 0.76,
      "skew": "symmetric",
      "notes": "Excellent infrastructure and low disaster exposure; healthcare strong; crime score the one complicating factor but still low by US/Mexico standards.",
      "sub_factors": {
        "climate": { "score": 3, "weight": 0.20, "confidence": 0.70, "notes": "Relative beneficiary: longer growing seasons, lower heating costs; some forest-fire/Baltic exposure." },
        "healthcare": { "score": 4, "weight": 0.30, "confidence": 0.80, "notes": "Universal single-payer; strong outcomes; some primary-care/specialist wait times." },
        "infrastructure": { "score": 5, "weight": 0.20, "confidence": 0.80, "notes": "Excellent transport, world-leading broadband, low-carbon stable grid (nuclear/hydro), strong transit." },
        "crime_safety": { "score": 1, "weight": 0.15, "confidence": 0.70, "notes": "Homicide ~1/100k (low by US/Mexico standard, high by Nordic standard); gang violence concentrated; most of country very safe; trend improving." },
        "disaster_insurance": { "score": 5, "weight": 0.15, "confidence": 0.80, "notes": "Low disaster exposure (minimal quake, no hurricanes); functional insurance; strong response capacity." }
      }
    },
    "personal_fit": {
      "score": 5,
      "confidence": 0.75,
      "skew": "symmetric",
      "notes": "Strong life-sciences sector (AstraZeneca HQ, Karolinska, Uppsala BMC, Lund, SLU, Gothenburg). ECLAM-recognized; ACLAM workable via IACLAM temporary diplomate status. Higher friction than Canada (authority recognition, possible Swedish-language requirement for clinical work; research often English). EU Blue Card available. Salaries lower absolute (SEK 700K-1.2M) but strong benefits.",
      "sub_factors": {
        "labanimal_vet_fit": { "score": 5, "weight": 1.0, "confidence": 0.75, "notes": "Institutions accustomed to hiring internationally; AAALAC recognizes ACLAM as equivalent; +5 not +7 due to language and process friction." }
      }
    }
  },
  "decisions": {
    "living": { "score": 3.86, "confidence": 0.77, "horizon": "5-10y", "reading": "clear positive" },
    "assets": { "score": 3.65, "confidence": 0.78, "horizon": "3-7y", "reading": "clear positive" },
    "currency": { "score": 3.86, "confidence": 0.76, "horizon": "1-3y", "reading": "clear positive" }
  },
  "summary": "Strongest overall profile in the comparison. Highest institutional (+6.4) and among the highest economic (+3.7) scores. Takes hits on political/social (gang violence, immigration restrictiveness) and geopolitical (direct Russia exposure). Edges Canada slightly once personal fit is included, though the two are effectively tied. Highest-quality option but higher-friction relocation than Canada."
}
