{
  "country": "Canada",
  "iso3": "CAN",
  "methodology_version": "2.0-pre-source-audit",
  "assessed_on": "2026-05-28",
  "subject_profile": {
    "summary": "Highly educated American, board-certified laboratory animal veterinarian (ACLAM), considering relocation.",
    "profession": "Board-certified laboratory animal veterinarian (ACLAM)",
    "citizenship": "United States",
    "stated_values": [
      "Rule of law and institutional integrity weighted most heavily",
      "Personal freedom and security from arbitrary state action are foundational",
      "Economic success is contingent on rule of law, not a substitute for it"
    ]
  },
  "flags": [
    "Scores predate full v2 source-discipline re-run.",
    "Minor arithmetic note: institutional composite recomputed at +4.17 (originally reported +4.2)."
  ],
  "category_weights_by_decision": {
    "living": { "economic": 0.15, "institutional": 0.30, "political_social": 0.25, "geopolitical": 0.05, "physical_practical": 0.10, "personal_fit": 0.15 },
    "assets": { "economic": 0.40, "institutional": 0.25, "political_social": 0.10, "geopolitical": 0.15, "physical_practical": 0.10, "personal_fit": 0.0 },
    "currency": { "economic": 0.60, "institutional": 0.20, "political_social": 0.05, "geopolitical": 0.15, "physical_practical": 0.0, "personal_fit": 0.0 }
  },
  "categories": {
    "economic": {
      "score": 0.7,
      "confidence": 0.78,
      "skew": "symmetric",
      "notes": "Better starting fiscal position than US; strong central-bank and banking institutions; main drag is involuntary trade exposure to US actions.",
      "sub_factors": {
        "fiscal_state": { "score": -2, "weight": 0.25, "confidence": 0.75, "notes": "Deficit ~2.1% GDP declining to 1.4% by 2030-31; lowest debt-to-GDP in G7; Carney investment-led growth with planned operational cuts." },
        "monetary_independence": { "score": 3, "weight": 0.25, "confidence": 0.80, "notes": "Bank of Canada strong independence; no political pressure campaign; inflation target intact." },
        "reserve_currency_intl_monetary": { "score": 0, "weight": 0.20, "confidence": 0.85, "notes": "CAD not a reserve currency; factor effectively neutral." },
        "inflation": { "score": 2, "weight": 0.15, "confidence": 0.75, "notes": "Near 2% target; less oil-shock exposure (own production); housing cost structural problem." },
        "banking_stability": { "score": 4, "weight": 0.10, "confidence": 0.80, "notes": "Big Six oligopoly, strong capital, conservative lending, robust OSFI." },
        "trade_policy": { "score_near": -5, "score_long": -3, "score": null, "weight": 0.05, "confidence": 0.80, "notes": "Heavy involuntary US tariff exposure under USMCA; diversifying toward EU/Asia; adaptation assumed over time." }
      }
    },
    "institutional": {
      "score": 4.17,
      "confidence": 0.77,
      "skew": "symmetric",
      "notes": "Strong across the board; among top-15 globally on rule of law.",
      "sub_factors": {
        "rule_of_law": { "score": 5, "weight": 0.35, "confidence": 0.80, "notes": "Independent, respected Supreme Court; notwithstanding-clause friction operates within rule-of-law framework; WJP top 15." },
        "statistical_integrity": { "score": 5, "weight": 0.25, "confidence": 0.80, "notes": "Statistics Canada highly regarded; no documented interference." },
        "civil_service_capacity": { "score": 2, "weight": 0.25, "confidence": 0.70, "notes": "Major restructuring; Carney planned 7.5-15% operational cuts on normal timelines." },
        "press_freedom": { "score": 4, "weight": 0.15, "confidence": 0.75, "notes": "Consistently high rankings; CBC under pressure but operating; some consolidation concerns." }
      }
    },
    "political_social": {
      "score": 2.0,
      "confidence": 0.73,
      "skew": "symmetric",
      "notes": "Well below US polarization; immigration less welcoming than 5y ago but orderly. Long-term composite ~+1.94 as demographics soften.",
      "sub_factors": {
        "political_stability": { "score": 3, "weight": 0.30, "confidence": 0.75, "notes": "Carney Liberal minority since April 2025; stable in operation; peaceful transfers the norm." },
        "civil_liberties": { "score": 2, "weight": 0.20, "confidence": 0.70, "notes": "Charter protections; some concerns (Online Streaming Act, C-63, 2022 Emergencies Act use) within judicial oversight." },
        "treatment_non_citizens": { "score": 2, "weight": 0.25, "confidence": 0.75, "notes": "Immigration targets cut, student caps, TFW restricted, PR narrowed; but due process maintained, no mass deportation, system within rule of law." },
        "social_cohesion": { "score": 3, "weight": 0.15, "confidence": 0.70, "notes": "Rising polarization from higher baseline; Quebec and Indigenous tensions managed; limited political violence." },
        "demographics": { "score_near": -2, "score_long": -4, "score": null, "weight": 0.10, "confidence": 0.75, "notes": "Growth was immigration-driven, now declining due to cuts; below-replacement native fertility; aging." }
      }
    },
    "geopolitical": {
      "score": 0.4,
      "confidence": 0.75,
      "skew": "symmetric",
      "notes": "Strong on conflict-avoidance and sanctions safety; negative only on alliance reliability due to direct US targeting.",
      "sub_factors": {
        "alliance_reliability": { "score": -3, "weight": 0.40, "confidence": 0.75, "notes": "Five Eyes degraded (Canada specifically targeted for removal); US tariff warfare; pivoting to Canada-Nordic frameworks, EU; AUKUS exclusion painful but adapting." },
        "conflict_involvement": { "score": 3, "weight": 0.35, "confidence": 0.75, "notes": "No active conflicts; limited NATO obligations; Arctic contested but not militarized; no Iran involvement." },
        "sanctions_capital_controls": { "score": 2, "weight": 0.25, "confidence": 0.75, "notes": "Follows Western sanctions; not a major imposer; no capital controls; some secondary exposure to US actions." }
      }
    },
    "physical_practical": {
      "score": 2.5,
      "confidence": 0.73,
      "skew": "symmetric",
      "notes": "Universal healthcare with access problems but better aggregate outcomes than US; very low violent crime.",
      "sub_factors": {
        "climate": { "score_near": 1, "score_long": 2, "score": null, "weight": 0.20, "confidence": 0.65, "notes": "Net beneficiary in parts (northern agriculture, heating); wildfire and Arctic/permafrost exposure; BC/Ontario favored." },
        "healthcare": { "score": 3, "weight": 0.30, "confidence": 0.75, "notes": "Universal single-payer; primary-care shortages and wait times; lower cost, better outcomes than US." },
        "infrastructure": { "score": 2, "weight": 0.20, "confidence": 0.70, "notes": "Adequate; housing infrastructure investment planned; good transit in major cities; strong broadband." },
        "crime_safety": { "score": 5, "weight": 0.15, "confidence": 0.80, "notes": "Homicide ~1/3 of US; firearm violence vastly lower; mass shootings rare." },
        "disaster_insurance": { "score": 1, "weight": 0.15, "confidence": 0.70, "notes": "Rising wildfire/flood in regions but insurance markets functional; federal response intact." }
      }
    },
    "personal_fit": {
      "score": 7,
      "confidence": 0.85,
      "skew": "symmetric",
      "notes": "Highest-feasibility option. Active vet shortage incl. lab animal medicine; AAALAC facilities at every major institution; Express Entry fast and direct; ACLAM fully recognized; smoothest cultural transition. Salaries lower (CAD 130-220K).",
      "sub_factors": {
        "labanimal_vet_fit": { "score": 7, "weight": 1.0, "confidence": 0.85, "notes": "Open positions at Toronto, McGill, UBC, McMaster, Alberta, Calgary, Saskatchewan, Guelph; provincial licensure main hurdle; ~12-18 month realistic timeline." }
      }
    }
  },
  "decisions": {
    "living": { "score": 3.25, "confidence": 0.76, "horizon": "5-10y", "reading": "clear positive" },
    "assets": { "score": 1.82, "confidence": 0.76, "horizon": "3-7y", "reading": "mixed-positive" },
    "currency": { "score": 1.46, "confidence": 0.74, "horizon": "1-3y", "reading": "mixed-positive" }
  },
  "summary": "Highest-feasibility strong option for the subject. Strong institutions (+4.17), positive political/social state, excellent personal fit (active vet shortage, fast Express Entry, full ACLAM recognition). Main weaknesses are involuntary US trade exposure and degraded alliance position from being directly targeted by the US. Roughly tied with Sweden once personal fit is included; the choice between them is preference-driven."
}
